[
    {
        "context_type": "scene_function",
        "context_value": "general_visibility",
        "source": "McCandless - A Method of Lighting the Stage",
        "priority": 0.9,
        "conflict_priority": 8,
        "layer_compatibility": [
            "primary"
        ],
        "blending_mode": "average",
        "rules": {
            "intensity": {
                "preferred_range": [
                    0.6,
                    0.8
                ]
            },
            "color": {
                "temperature": "neutral"
            },
            "beam_angle": {
                "type": "medium"
            }
        }
    },
    {
        "context_type": "technique",
        "context_value": "mccandless_system",
        "source": "McCandless - A Method of Lighting the Stage, p.55",
        "priority": 0.95,
        "conflict_priority": 9,
        "layer_compatibility": [
            "primary"
        ],
        "blending_mode": "average",
        "rules": {
            "intensity": {
                "mode": "static"
            },
            "color": {
                "palettes": [
                    "amber",
                    "blue"
                ],
                "temperature": "neutral"
            }
        }
    },
    {
        "context_type": "emotion",
        "context_value": "joy",
        "source": "Rosenthal - The Magic of Light",
        "priority": 0.8,
        "conflict_priority": 5,
        "layer_compatibility": [
            "primary",
            "secondary"
        ],
        "blending_mode": "add",
        "rules": {
            "intensity": {
                "preferred_range": [
                    0.7,
                    1.0
                ]
            },
            "color": {
                "temperature": "warm",
                "palettes": [
                    "amber",
                    "yellow",
                    "pink"
                ]
            },
            "movement": {
                "pattern": "ballyhoo",
                "speed": "medium"
            },
            "transitions": {
                "speed": "medium",
                "preferred_types": [
                    "fade"
                ]
            }
        }
    },
    {
        "context_type": "emotion",
        "context_value": "fear",
        "source": "McCandless - A Method of Lighting the Stage",
        "priority": 0.85,
        "conflict_priority": 6,
        "layer_compatibility": [
            "primary"
        ],
        "blending_mode": "override",
        "rules": {
            "intensity": {
                "preferred_range": [
                    0.1,
                    0.4
                ]
            },
            "color": {
                "temperature": "cool",
                "palettes": [
                    "dark_blue",
                    "cold_white",
                    "green"
                ]
            },
            "gobo": {
                "pattern": "sharp_breakup",
                "focus": "sharp"
            },
            "transitions": {
                "speed": "slow",
                "preferred_types": [
                    "fade"
                ]
            }
        }
    },
    {
        "context_type": "emotion",
        "context_value": "anger",
        "source": "Clifton Taylor - Color and Light",
        "priority": 0.8,
        "conflict_priority": 7,
        "layer_compatibility": [
            "primary",
            "secondary"
        ],
        "blending_mode": "override",
        "rules": {
            "intensity": {
                "preferred_range": [
                    0.5,
                    1.0
                ]
            },
            "color": {
                "temperature": "warm",
                "palettes": [
                    "red",
                    "deep_red",
                    "orange"
                ]
            },
            "transitions": {
                "speed": "fast",
                "preferred_types": [
                    "cut",
                    "snap"
                ]
            },
            "beam_angle": {
                "type": "narrow"
            }
        }
    },
    {
        "context_type": "emotion",
        "context_value": "sadness",
        "source": "Pilbrow - Stage Lighting Design",
        "priority": 0.75,
        "conflict_priority": 4,
        "layer_compatibility": [
            "primary",
            "secondary"
        ],
        "blending_mode": "average",
        "rules": {
            "intensity": {
                "preferred_range": [
                    0.2,
                    0.5
                ]
            },
            "color": {
                "temperature": "cool",
                "palettes": [
                    "lavender",
                    "blue",
                    "grey"
                ]
            },
            "gobo": {
                "pattern": "rain",
                "rotation": false
            },
            "transitions": {
                "speed": "slow",
                "preferred_types": [
                    "fade"
                ]
            },
            "beam_angle": {
                "type": "narrow"
            }
        }
    },
    {
        "context_type": "emotion",
        "context_value": "mystery",
        "source": "McCandless - A Method of Lighting the Stage",
        "priority": 0.7,
        "conflict_priority": 5,
        "layer_compatibility": [
            "primary",
            "secondary"
        ],
        "blending_mode": "multiply",
        "rules": {
            "intensity": {
                "preferred_range": [
                    0.0,
                    0.3
                ]
            },
            "color": {
                "temperature": "cool",
                "palettes": [
                    "uv",
                    "dark_blue"
                ]
            },
            "gobo": {
                "pattern": "fog",
                "focus": "soft"
            },
            "transitions": {
                "speed": "slow"
            }
        }
    },
    {
        "context_type": "emotion",
        "context_value": "romantic",
        "source": "Rosenthal - The Magic of Light",
        "priority": 0.7,
        "conflict_priority": 3,
        "layer_compatibility": [
            "secondary",
            "accent"
        ],
        "blending_mode": "add",
        "rules": {
            "intensity": {
                "preferred_range": [
                    0.4,
                    0.6
                ]
            },
            "color": {
                "temperature": "warm",
                "palettes": [
                    "rose",
                    "peach"
                ]
            },
            "gobo": {
                "pattern": "leaves",
                "focus": "soft"
            }
        }
    },
    {
        "context_type": "emotion",
        "context_value": "nostalgia",
        "source": "Francis Reid - The Stage Lighting Handbook",
        "priority": 0.65,
        "conflict_priority": 2,
        "layer_compatibility": [
            "secondary",
            "accent"
        ],
        "blending_mode": "add",
        "rules": {
            "color": {
                "temperature": "warm",
                "palettes": [
                    "sepia",
                    "amber"
                ]
            },
            "beam_angle": {
                "type": "wash"
            }
        }
    },
    {
        "context_type": "script_type",
        "context_value": "formal_event",
        "source": "Shelley - A Practical Guide to Stage Lighting",
        "priority": 0.95,
        "conflict_priority": 10,
        "layer_compatibility": [
            "primary"
        ],
        "blending_mode": "override",
        "rules": {
            "intensity": {
                "preferred_range": [
                    0.8,
                    1.0
                ],
                "mode": "static"
            },
            "color": {
                "temperature": "neutral",
                "palettes": [
                    "white"
                ]
            },
            "transitions": {
                "speed": "medium",
                "preferred_types": [
                    "cut"
                ]
            }
        }
    },
    {
        "context_type": "scene_function",
        "context_value": "transition",
        "source": "Francis Reid - The Stage Lighting Handbook",
        "priority": 1.0,
        "conflict_priority": 10,
        "layer_compatibility": [
            "primary"
        ],
        "blending_mode": "override",
        "rules": {
            "intensity": {
                "preferred_range": [
                    0.0,
                    0.1
                ]
            },
            "color": {
                "palettes": [
                    "blackout",
                    "dark_blue"
                ]
            },
            "transitions": {
                "speed": "medium",
                "preferred_types": [
                    "fade"
                ]
            }
        }
    },
    {
        "context_type": "emotion",
        "context_value": "surprise",
        "source": "Clifton Taylor - Color and Light",
        "priority": 0.85,
        "conflict_priority": 8,
        "layer_compatibility": [
            "primary",
            "accent"
        ],
        "blending_mode": "override",
        "rules": {
            "intensity": {
                "preferred_range": [
                    0.8,
                    1.0
                ]
            },
            "color": {
                "temperature": "cool",
                "palettes": [
                    "white",
                    "cyan"
                ]
            },
            "transitions": {
                "speed": "instant",
                "preferred_types": [
                    "cut",
                    "flash"
                ]
            }